1,It Cosmetics,CC+ Cream with SPF 50+,4.5,39.50,39.50
2,bareMinerals,Complexion Rescue Tinted Hydrating Gel Cream Broad Spectrum SPF 30,4.5,32.00,32.00
3,Murad,Hydro-Dynamic Ultimate Moisture,4.5,75.00,75.00
4,Mario Badescu,Facial Spray With Aloe| Herbs and Rosewater,4.5,7.00 , 12.00
5,It Cosmetics,Bye Bye Foundation Full Coverage Moisturizer with SPF 50+,4.0,39.50,39.50
6,It Cosmetics,Confidence In A Cream Hydrating Moisturizer,4.5,49.00,49.00
7,Clinique,Moisture Surge 72 Hour Auto-Replenishing Hydrator,4.5,21.00 , 78.00
8,Mario Badescu,Spritz. Mist. Glow. Set,4.5,21.00,21.00
9,Juice Beauty,STEM CELLULAR Anti-Wrinkle Overnight Cream,4.0,75.00,75.00
10,It Cosmetics,CC+ Cream Illumination SPF 50+,4.5,39.50,39.50
11,Clinique,Dramatically Different Moisturizing Lotion+,4.5,15.00 , 28.00
12,PEACH & LILY,Matcha Pudding Antioxidant Cream,4.5,40.00,40.00
13,Neutrogena,Hydro Boost Water Gel,4.5,23.99,23.99
14,bareMinerals,Butter Drench Restorative Rich Cream,4.5, 			28.50, 			28.50
15,Tula,24-7 Moisture Hydrating Day & Night Cream,4.5,52.00,52.00
16,Dermadoctor,Kakadu C High Potency Evening Oil,4.0,74.00,74.00
17,Kiehl's Since 1851,Ultra Facial Cream,4.5,18.00 , 53.00
18,Perricone MD,High Potency Classics: Face Finishing & Firming Moisturizer,4.5,69.00,69.00
19,Philosophy,Renewed Hope In A Jar,4.5,39.00 , 65.00
20,Peter Thomas Roth,Hungarian Thermal Water Mineral-Rich Moisturizer,4.0,58.00,58.00
21,Perricone MD,High Potency Classics Face Finishing & Firming Tinted Moisturizer SPF 30,4.0,69.00,69.00
22,Dermalogica,Dynamic Skin Recovery Broad Spectrum SPF 50,4.5,75.00,75.00
23,Peter Thomas Roth,Water Drench Hyaluronic Cloud Cream,4.5, 			52.00 , 99.00
24,Clinique,Moisture Surge Intense Skin Fortifying Hydrator,4.5,39.50 , 54.00
25,Juice Beauty,STEM CELLULAR Anti-Wrinkle Moisturizer,4.5,70.00,70.00
26,The Ordinary,100% Organic Cold Pressed Rose Hip Seed Oil,4.5,9.80,9.80
27,NARS,Pure Radiant Tinted Moisturizer,4.5,45.00,45.00
28,Erborian,Online Only BB Crème,4.5,39.00,39.00
29,First Aid Beauty,Ultra Repair Cream,4.5,34.00,34.00
30,Dermalogica,Intensive Moisture Balance,4.5,44.00 , 72.00
31,Clinique,Limited Edition Jumbo Dramatically Different Moisturizing Lotion+,4.5,39.00,39.00
32,Dermalogica,Age Smart Super Rich Repair,5.0,89.00,89.00
33,It Cosmetics,Confidence in a Cream Rosy Tone Moisturizer,4.5,49.00,49.00
34,It Cosmetics,Confidence in Your Beauty Sleep Night Cream,4.5,54.00,54.00
35,PEACH & LILY,Lazy Day's All-In-One Moisture Pad,4.5, 			27.30, 			27.30
36,Philosophy,Ultimate Miracle Worker SPF 30,4.5,75.00,75.00
37,The Better Skin Co.,Better Skin Mirakle Cream,4.0, 			8.50, 			8.50
38,CeraVe,PM Facial Moisturizing Lotion,4.5,15.99,15.99
39,StriVectin,SD Advanced Plus Intensive Moisturizing Concentrate For Wrinkles & Stretch Marks,4.5,79.00 , 139.00
40,Jack Black,Double Duty Face Moisturizer SPF 20,5.0,28.00 , 48.00
41,Mario Badescu,Facial Spray with Aloe| Chamomile and Lavender,4.0,7.00 , 12.00
42,Philosophy,Anti-Wrinkle Miracle Worker+ Line Correcting Moisturizer,4.5,64.00,64.00
43,Clinique,Clinique iD Dramatically Different Base,4.0,25.00,25.00
44,Juice Beauty,STEM CELLULAR CC Cream,4.0,39.00,39.00
45,It Cosmetics,Confidence In A Neck Cream Moisturizer,4.5,52.00,52.00
46,Juice Beauty,GREEN APPLE Age Defy Moisturizer,4.5,50.00,50.00
47,bareMinerals,Bare Haven Essential Moisturizing Soft Cream,4.5, 			26.25 , 41.25
48,It Cosmetics,Travel Size CC+ Cream with SPF 50+,4.0,15.50,15.50
49,Estée Lauder,Revitalizing Supreme+ Global Anti-Aging Cell Power Creme,4.0, 			55.00 , 65.00
50,Dermalogica,Antioxidant HydraMist,4.5,45.00,45.00
51,Mario Badescu,Hydro Moisturizer With Vitamin C,4.5,18.00,18.00
52,Erborian,Online Only CC Crème,4.5,44.00,44.00
53,Mad Hippie,Antioxidant Facial Oil,4.5,24.99,24.99
54,bareMinerals,Prime Time BB Primer-Cream Daily Defense Broad Spectrum SPF 30,4.5,27.00,27.00
55,Estée Lauder,DayWear Multi-Protection Anti-Oxidant 24H-Moisture Crème Broad Spectrum SPF 15,4.0, 			34.00, 			34.00
56,Benefit Cosmetics,Total Moisture Facial Cream,4.5,42.00,42.00
57,Philosophy,Purity Made Simple Moisturizer,4.0,25.00,25.00
58,Philosophy,Renewed Hope In A Jar SPF 30,4.5,39.00,39.00
59,First Aid Beauty,Ultra Repair Face Moisturizer,4.5,24.00,24.00
60,Perricone MD,Cold Plasma Sub-D,4.0,135.00,135.00
61,Clinique,Dramatically Different Moisturizing Cream,5.0,28.00,28.00
62,Skyn Iceland,Pure Cloud Cream,4.5,55.00,55.00
63,Dermalogica,Calm Water Gel,4.5,50.00,50.00
64,The Ordinary,100% Cold Pressed Virgin Marula Oil,4.5,9.90,9.90
65,Curél,Intensive Moisture Facial Cream,4.5,30.00,30.00
66,Clinique,Smart Night Custom-Repair Moisturizer For Dry Combination,4.5,58.00,58.00
67,boscia,Rosehip Omega Face Oil,4.5,42.00,42.00
68,Smashbox,Camera Ready BB Cream Broad Spectrum SPF 35,4.0,42.00,42.00
69,Lancôme,Bienfait Multi-Vital SPF 30 Day Cream Moisturizer,4.5,50.00,50.00
70,StriVectin,Advanced Retinol Intensive Night Moisturizer,4.5,79.00 , 112.00
71,Philosophy,Renewed Hope in a Jar Water Cream Hyaluronic Glow Moisturizer,4.5,39.00,39.00
72,Smashbox,Photo Finish Primerizer,4.5,42.00,42.00
73,bareMinerals,Skinlongevity Vital Power Sleeping Gel Cream,4.5, 			28.50, 			28.50
74,CeraVe,AM Facial Moisturizing Lotion SPF 30,3.5,18.99,18.99
75,Clinique,Clinique iD Active Cartridge Concentrate,4.0,14.00,14.00
76,Murad,Essential-C Day Moisture Broad Spectrum SPF 30 / PA+++,4.5,65.00,65.00
77,Tarte,Maracuja Oil,4.5,48.00,48.00
78,Jack Black,Intense Therapy Lip Balm SPF 25,4.5,8.00,8.00
79,Mario Badescu,Travel Size Facial Spray With Aloe| Herbs and Rosewater,4.5,5.00,5.00
80,Mad Hippie,Face Cream,4.5,25.99,25.99
81,PEACH & LILY,Pure Beam Luxe Oil,4.5, 			27.30, 			27.30
82,Lancôme,Bienfait Multi-Vital Night Cream Moisturizer,5.0,54.00,54.00
83,Mamonde,Rose Trial Kit,4.5, 			15.40, 			15.40
84,e.l.f. Cosmetics,Holy Hydration! Face Cream,4.5,12.00,12.00
85,MAC,Strobe Cream,4.5, 			21.00 , 35.00
86,Hey Honey,Online Only Trick and Treat CC² Active Propolis Color Correcting Cream,5.0,38.00,38.00
87,Clinique,Smart Broad Spectrum SPF 15 Custom-Repair Moisturizer For Dry Combination Skin,4.5,55.00,55.00
88,Philosophy,Ultimate Miracle Worker Night,4.0,80.00,80.00
89,Aquaphor,Lip Repair,4.5, 			2.99, 			2.99
90,ICONIC LONDON,Online Only Prep Set Glow,4.0,25.00,25.00
91,Clinique,Moisture Surge Hydrating Supercharged Concentrate,4.5,39.50,39.50
92,Clinique,Clinique Smart Clinical MD Multi-Dimensional Age Transformer Duo Resculpt + Revolumize,4.0,69.00,69.00
93,Neutrogena,Bright Boost Gel Cream,3.0,23.99,23.99
94,Kate Somerville,Wrinkle Warrior 2-in-1 Plumping Moisturizer + Serum,4.5,95.00,95.00
95,Exuviance,Age Reverse Day Repair SPF 30,4.5,75.00,75.00
96,Smashbox,Photo Finish Primer Oil,4.5,42.00,42.00
1,Dermalogica,Sheer Tint SPF 20,4.5,45.00,45.00
2,CeraVe,SA Moisturizing Cream For Rough & Bumpy Skin,4.5,23.99,23.99
3,Tula,Dew Your Thing Oil Free Gel Cream,4.5,48.00,48.00
4,Mario Badescu,Vitamin A-D-E Neck Cream,4.5,20.00,20.00
5,Juice Beauty,STEM CELLULAR Lifting Neck Cream,4.5,60.00,60.00
6,It Cosmetics,Travel Size Confidence In A Cream Hydrating Moisturizer,4.5,17.00,17.00
7,Derma E,Vitamin C Intense Night Cream,4.5,19.99,19.99
8,Origins,GinZing Ultra-Hydrating Energy-Boosting Cream,4.0,30.00,30.00
9,Neutrogena,Rapid Wrinkle Repair Night Moisturizer,4.0,23.99,23.99
10,Mario Badescu,Buttermilk Moisturizer,4.5,18.00,18.00
11,Estée Lauder,Revitalizing Supreme+ Global Anti-Aging Cell Power Creme SPF 15,4.0, 			55.00 , 80.00
12,Clinique,Dramatically Different Hydrating Jelly,4.0,15.00 , 28.00
13,Derma E,Online Only Advanced Peptide & Collagen Serum,5.0,36.50,36.50
14,Philosophy,Anti-Wrinkle Miracle Worker+ Line Correcting Moisturizer Overnight Cream,3.5,68.00,68.00
15,Mario Badescu,Rose Hip Nourishing Oil,4.5,22.00,22.00
16,First Aid Beauty,Ultra Repair Oat & Cannabis Sativa Seed Oil,4.0,30.00,30.00
17,Erborian,Online Only CC Red Correct,4.5,44.00,44.00
18,Peter Thomas Roth,Water Drench Hyaluronic Cloud Serum,4.5,65.00,65.00
19,La Roche-Posay,Toleriane Double Repair Face Moisturizer UV SPF 30,4.0,19.99,19.99
20,Mario Badescu,Collagen Moisturizer SPF 15,4.0,24.00,24.00
21,ULTA,Waterfull Gel - Cream Moisturizer,4.5,19.50,19.50
22,It Cosmetics,Anti-Aging Armour Tinted Sunscreen SPF 50+,4.5,38.00,38.00
23,Murad,Oil and Pore Control Mattifier Broad Spectrum SPF 45 PA++++,4.0,42.00,42.00
24,Murad,Nutrient-Charged Water Gel,4.5,60.00,60.00
25,IPKN,Online Only Moist & Firm BB Cream,4.5,29.00,29.00
26,Too Cool For School,Egg Mellow Cream,4.0,36.00,36.00
27,Teami Blends,Repair Tea Infused Facial Oil,4.5, 			24.00, 			24.00
28,Mamonde,Rose Water Gel Cream,4.5, 			18.20, 			18.20
29,Neutrogena,Rapid Wrinkle Repair Moisturizer SPF 30,4.5,23.99,23.99
30,Trilogy,Certified Organic Rosehip Oil,4.5, 			20.30 , 37.80
31,Estée Lauder,Online Only Resilience Multi-Effect Tri-Peptide Face and Neck Creme SPF 15,4.0, 			58.00 , 90.00
32,Kiehl's Since 1851,Super Multi Corrective Cream,5.0,65.00,65.00
33,Mario Badescu,Chamomile Night Cream,4.5,20.00,20.00
34,Ahava,Essential Day Moisturizer Normal to Dry,4.5,45.00,45.00
35,Clinique,Superdefense Daily Defense Moisturizer Broad Spectrum SPF 20,4.5,48.00,48.00
36,Neutrogena,Rapid Wrinkle Repair Retinol Oil,4.0,27.99,27.99
37,Lancôme,UV Expert Mineral CC Cream SPF 50,3.0,39.00,39.00
38,Mario Badescu,Travel Size Facial Spray with Aloe| Chamomile and Lavender,4.5,5.00,5.00
39,StriVectin,Tightening & Sculpting Face Cream,4.5,95.00,95.00
40,Weleda,Skin Food Original Ultra-Rich Cream,4.5,12.49 , 18.99
41,Perricone MD,High Potency Classics Hyaluronic Intensive Moisturizer,4.5,69.00,69.00
42,Kate Somerville,Age Arrest Anti-Wrinkle Cream,5.0,90.00,90.00
43,Kate Somerville,ExfoliKate Glow Moisturizer,4.5,65.00,65.00
44,Perricone MD,Cold Plasma+ Neck & Chest Broad Spectrum SPF 25,4.5,89.00,89.00
45,Murad,Retinol Youth Renewal Night Cream,5.0,82.00,82.00
46,Mad Hippie,Hydrating Nutrient Mist,4.0,19.99,19.99
47,Skyn Iceland,Oxygen Infusion Night Cream,4.0,68.00,68.00
48,Skyn Iceland,Hydro Cool Firming Neck Gels,5.0,35.00,35.00
49,Aveeno,Positively Radiant Daily Moisturizer SPF 30,4.5,18.99,18.99
50,Proactiv,Green Tea Moisturizer,4.5,40.00,40.00
51,Clinique,Smart Night Custom-Repair Moisturizer For Very Dry Skin,4.5,58.00,58.00
52,Lancôme,Visionnaire Advanced Multi-Correcting Cream,4.5,90.00,90.00
53,Murad,Anti-Aging Moisturizer Broad Spectrum SPF 30 / PA+++,4.5,50.00,50.00
54,Tarte,Travel Size Maracuja Oil,4.5,16.00,16.00
55,Vichy,LiftActiv Peptide-C Anti-Aging Face Moisturizer,4.5,39.00,39.00
56,Kate Somerville,Goat Milk Moisturizing Cream,4.5,65.00,65.00
57,Tarte,Double Duty Beauty First Step Prep Moisture Reset Cream,4.5, 			26.25, 			26.25
58,Estée Lauder,Online Only NightWear Plus Anti-Oxidant Night Detox Crème,4.5, 			36.00, 			36.00
59,Mario Badescu,Glycolic Skin Renewal Complex,4.5,35.00,35.00
60,Origins,Plantscription Youth-Renewing Power Night Cream,4.5,62.00,62.00
61,Cetaphil,Moisturizing Cream,4.5,10.99 , 17.99
62,Exuviance,Age Reverse HydraFirm,4.0,79.00,79.00
63,Perricone MD,Essential Fx Acyl-Glutathione Rejuvenating Moisturizer,4.5, 			68.60, 			68.60
64,Bliss,Drench & Quench Moisturizer,4.5,20.00,20.00
65,e.l.f. Cosmetics,SuperHydrate Moisturizer,3.5,12.00,12.00
66,Kiehl's Since 1851,Cannabis Sativa Seed Oil Herbal Concentrate,4.5,50.00,50.00
67,Exuviance,Lift Volumizing Concentrate,4.5,87.00,87.00
68,Botanics,Botanics Organic Restoring Night Oil,5.0,17.99,17.99
69,MAC,Strobe Cream Mini MAC,4.5,16.00,16.00
70,Juice Beauty,STEM CELLULAR Vinifera Replenishing Oil,5.0,72.00,72.00
71,Dermalogica,Skin Hydrating Booster,4.5,64.00,64.00
72,Thayers,Alcohol-Free Witch Hazel Facial Mist,5.0,10.95,10.95
73,Eos,FlavorLab Super Soft Shea Lip Balm Duo,4.0, 			4.39, 			4.39
74,ULTA,Watermelon Facial Mist,4.0,10.00,10.00
75,Shiseido,Bio-Performance Advanced Super Revitalizing Cream,4.5,82.00 , 104.00
76,StriVectin,Travel Size TL Tightening Neck Cream,4.0,15.00,15.00
77,Pacifica,Coconut Probiotic Water Rehab Cream,4.5,16.00,16.00
78,StriVectin,Online Only The Little Lifters Limited Edition Kit,5.0,59.00,59.00
79,StriVectin,S.T.A.R. Light Retinol Night Oil,4.5,99.00,99.00
80,Mario Badescu,Caviar Night Cream,4.5,22.00,22.00
81,Exuviance,CitraFirm Face Oil,5.0, 			50.40, 			50.40
82,ULTA,Velvetskin Melting Moisturizer,4.0,19.50,19.50
83,Formula 10.0.6,Thirst No More! Moisturizer,4.5,8.99,8.99
84,Clinique,Dramatically Different Moisturizing BB-Gel,4.0,15.00,15.00
85,Mamonde,Calming Hydro Sleeping Mask,4.5, 			17.50, 			17.50
86,Cetaphil,Moisturizing Lotion,4.5,13.99,13.99
87,The Ordinary,100% Organic Cold Pressed Moroccan Argan Oil,3.5,6.80,6.80
88,Clinique,Clinique Smart Clinical MD Multi-Dimensional Age Transformer Resculpt,4.5,69.00,69.00
89,La Roche-Posay,Online Only Toleriane Double Repair Moisturizer,4.0,19.99,19.99
90,Peter Thomas Roth,Potent-C Bright & Plump Moisturizer,3.5,26.00 , 68.00
91,Dermalogica,Clear Start Clearing Defense Moisturizer SPF 30,4.5,28.00,28.00
92,StriVectin,Tightening Neck Serum Roller,4.5,89.00,89.00
93,Neutrogena,Oil-Free Moisture Sensitive Skin Ultra-Gentle Facial Moisturizer,4.5,12.49,12.49
94,I Dew Care,Plush Party Buttery Vitamin C Lip Mask,4.5,16.00,16.00
95,Origins,Travel Size Original Skin Matte Moisturizer with Willowherb,5.0,20.50,20.50
96,Dermalogica,Phyto Replenish Oil,4.5,76.00,76.00
1,Juice Beauty,Nutrient Moisturizer,4.0,42.00,42.00
2,ELEMIS,Pro-Collagen Marine Cream SPF 30,4.5,128.00,128.00
3,Lancôme,Bienfait Multi-Vital Sunscreen Lotion Broad Spectrum SPF 30,5.0,50.00,50.00
4,Clinique,Clinique Smart Clinical MD Multi-Dimensional Age Transformer Revolumize,4.5,69.00,69.00
5,belif,The True Cream-Moisturizing Bomb,5.0,38.00,38.00
6,Dermadoctor,Wrinkle Revenge Rescue & Protect Facial Cream,4.5,58.00,58.00
7,Neutrogena,Rapid Wrinkle Repair Serum,4.0,23.99,23.99
8,Eos,100% Natural Shea Lip Balm 2 Pack,4.0, 			4.39, 			4.39
9,Perricone MD,Online Only Vitamin C Ester Brightening Overnight Treatment,4.5,99.00,99.00
10,Lancôme,Rénergie Multi-Glow Rosy Tone Moisturizer Cream,4.5,99.00,99.00
11,MAC,Mineralize Timecheck Lotion,4.0,45.00,45.00
12,Murad,City Skin Overnight Detox Moisturizer,4.5,72.00,72.00
13,bareMinerals,Complexion Rescue Defense Radiant Protective Veil Broad Spectrum SPF 30,4.0,39.00,39.00
14,Proactiv,Complexion Perfecting Hydrator,4.5,50.00,50.00
15,Mario Badescu,Cellufirm Moisturizer,4.5,18.00,18.00
16,Mario Badescu,Honey Moisturizer,4.0,25.00,25.00
17,Murad,Resurgence Age-Balancing Moisture Broad Spectrum SPF 30 / PA+++,4.5,74.00,74.00
18,Origins,High-Potency Night-A-Mins Resurfacing Cream with Fruit-Derived AHAs,3.5,46.00,46.00
19,bareMinerals,Ageless Genius Firming & Wrinkle Smoothing Neck Cream,3.5, 			33.75, 			33.75
20,bareMinerals,Poreless Oil-Free Moisturizer,5.0,35.00,35.00
21,Aveeno,Positively Radiant Daily Moisturizer SPF 15,4.5,18.99,18.99
22,L'Oréal,Online Only Collagen Moisture Filler Facial Day Night Cream,4.5,11.49,11.49
23,COSRX,Advanced Snail 92 All In One Cream,4.0,22.00,22.00
24,Clinique,Repairwear Laser Focus Night Line Smoothing Cream Very Dry to Dry Combination,4.5,53.00,53.00
25,Kiehl's Since 1851,Daily Reviving Concentrate,5.0,50.00 , 75.00
26,Oh K!,Chok Chok Glowing Moisturiser,4.5,14.99,14.99
27,Murad,Multi-Vitamin Infusion Oil,4.5,73.00,73.00
28,Juice Beauty,Prebiotix Hydrating Gel Moisturizer,4.0,52.00,52.00
29,boscia,Revitalizing Black Charcoal Hydration Gel,5.0,40.00,40.00
30,Mario Badescu,Protein Night Cream,4.0,22.00,22.00
31,Aveeno,Ultra-Calming Daily Moisturizer SPF 15,4.0,18.99,18.99
32,Murad,Perfecting Day Cream Broad Spectrum SPF 30 / PA +++,4.5,58.00,58.00
33,Juice Beauty,Organic Treatment Oil,5.0,42.00,42.00
34,Trilogy,Rosehip Oil Antioxidant+,4.5, 			30.80, 			30.80
35,COSRX,Honey Ceramide Full Moisture Cream,4.5,26.00,26.00
36,Peter Thomas Roth,Peptide 21 Lift & Firm Moisturizer,4.5,78.00,78.00
37,Kate Somerville,Oil Free Moisturizer,4.5,65.00,65.00
38,Mamonde,Floral Moisture Cream,4.5, 			24.50, 			24.50
39,Dermalogica,Power Rich,4.5,190.00,190.00
40,La Roche-Posay,Toleriane Ultra Night Cream for Sensitive Skin,4.5,29.99,29.99
41,Skinfood,Peach Jelly Soothing Gel 90,4.5,3.99,3.99
42,TONYMOLY,Cat's Purrfect Day Cream,5.0,20.00,20.00
43,DHC,Online Only Extra Nighttime Moisture,5.0,36.00,36.00
44,Lancôme,UV Expert Aquagel Defense Primer & Moisturizer SPF 50,4.5,39.00,39.00
45,Meaningful Beauty,Age Recovery Night Crème with Melon Extract & Retinol,4.5,68.00,68.00
46,Clarins,Super Restorative Night,4.5,137.00,137.00
47,Clinique,Travel Size Dramatically Different Moisturizing Lotion+,4.5,5.00,5.00
48,Shiseido,Essential Energy Moisturizing Cream,4.5,48.00,48.00
49,The Body Shop,Drops Of Youth Day Cream,4.5,34.00,34.00
50,Clarins,Multi-Active Day Cream SPF 20,4.5,55.00,55.00
51,Clinique,Repairwear Laser Focus Line Smoothing Cream Broad Spectrum SPF 15 Very Dry to Dry Combination,4.5,51.00,51.00
52,Estée Lauder,Online Only DayWear Multi-Protection Anti-Oxidant Sheer Tint Release Moisturizer SPF 15,4.0, 			34.00, 			34.00
53,First Aid Beauty,5 in 1 Face Cream SPF 30,4.0,40.00,40.00
54,Mario Badescu,Peptide Renewal Cream,4.0,35.00,35.00
55,Dermadoctor,Calm| Cool & Corrected Tranquility Cream,4.0,85.00,85.00
56,First Aid Beauty,Ultra Repair Cream Mango,5.0,34.00,34.00
57,Grown Alchemist,Hydra-Repair Day Cream,5.0,49.00,49.00
58,Derma E,Vitamin C Renewing Moisturizer,4.5,19.99,19.99
59,TONYMOLY,Panda's Dream Rose Hyaluronic Face Cream,4.5,18.50,18.50
60,Ahava,Night Replenisher Normal to Dry,4.5,51.00,51.00
61,Peter Thomas Roth,Travel Size Water Drench Hyaluronic Cloud Cream,4.5,22.00,22.00
62,Vichy,Aqualia Thermal Hydrating Night Cream with Hyaluronic Acid,4.5,28.00,28.00
63,Derma E,Hydrating Day Cream,4.0,24.99,24.99
64,TONYMOLY,The Chok Chok Green Tea Watery Cream,4.5,25.00,25.00
65,Vichy,Aqualia Thermal Rich Cream,4.5,31.00,31.00
66,Kiehl's Since 1851,Ultra Facial Moisturizer,4.5,32.00,32.00
67,Lano,Everywhere Multi-Cream,4.5,16.95,16.95
68,Skyn Iceland,Arctic Face Oil,4.5,42.00,42.00
69,Aveeno,Creamy Moisturizing Oil,4.5,8.99,8.99
70,Clarins,Extra-Firming Wrinkle Control Regenerating Night Cream All Skin Types,4.5,93.00,93.00
71,Juice Beauty,Travel Size STEM CELLULAR Anti-Wrinkle Moisturizer,5.0,25.00,25.00
72,Clarins,Super Restorative Day,4.5,129.00,129.00
73,Lancôme,Bienfait Aqua Vital Lotion Continuous Infusing Moisturizer,4.5,50.00,50.00
74,StriVectin,TL Advanced Light Tightening Neck Cream,4.5,95.00,95.00
75,COSRX,Oil Free Moisturizing Lotion,4.0,22.00,22.00
76,L'Oréal,Age Perfect Cell Renewal Rosy Tone Moisturizer,4.5,24.99,24.99
77,e.l.f. Cosmetics,Daily Hydration Moisturizer,4.0,8.00,8.00
78,Clinique,Smart Broad Spectrum SPF 15 Custom-Repair Moisturizer For Combination Oily Skin,4.5,55.00,55.00
79,Clinique,Clinique For Men Maximum Hydrator Activated Water-Gel Concentrate,4.5,39.50,39.50
80,Peter Thomas Roth,Water Drench Hyaluronic Cloud Hydrating Toner Mist,4.0,28.00,28.00
81,Kopari Beauty,Coconut Face Cream,5.0,38.00,38.00
82,ACURE,The Essentials Rosehip Oil,4.5,12.99,12.99
83,StriVectin,Multi-Action Restorative Cream,4.5,95.00,95.00
84,Clarins,Super Restorative Day SPF 20,4.5,129.00,129.00
85,Cetaphil,Facial Hydrating Lotion,4.0,17.99,17.99
86,e.l.f. Cosmetics,Hydrating Coconut Mist,4.5,8.00,8.00
87,Kiehl's Since 1851,Super Multi Corrective Cream SPF 30,5.0,68.00,68.00
88,Fountain of Truth,Good Day Soufflé Hydrating Moisturizer with SPF 15,4.5,60.00,60.00
89,ELEMIS,Superfood Day Cream,4.5,45.00,45.00
90,COSRX,Hyaluronic Acid Intensive Cream,4.5,22.00,22.00
91,The Body Shop,Online Only Oils Of Life Intensely Revitalising Cream,5.0,34.00,34.00
92,Peter Thomas Roth,10% Glycolic Solutions Moisturizer,4.0,45.00,45.00
93,PEACH & LILY,KBeauty Rescue Balm,4.0,28.00,28.00
94,Derma E,Derma E x SunKissAlba Radiant Glow Oil,4.5,19.99,19.99
95,Philosophy,Nature In A Jar Cica Complex Recovery Moisturizer,4.5,49.00,49.00
96,Kiehl's Since 1851,Ultra Facial Moisturizer SPF 30,4.5,32.00,32.00
1,Origins,Plantscription Powerful Lifting Cream,4.0,65.00,65.00
2,Origins,Blooming Sheer Lip Balm,4.5,20.00,20.00
3,DHC,Online Only Astaxanthin All-In-One Collagen Gel,4.5,49.00,49.00
4,boscia,Clear Complexion Tonic,5.0,26.00,26.00
5,Aveeno,Daily Moisturizer,4.0,18.99,18.99
6,Dermalogica,Travel Size Intensive Moisture Balance,4.5,16.50,16.50
7,Clinique,Smart Broad Spectrum SPF 15 Custom-Repair Moisturizer For Very Dry Skin,4.5,55.00,55.00
8,Shiseido,Treatment Softener,4.5,50.00,50.00
9,CeraVe,Skin Renewing Day Cream With Sunscreen SPF 30,3.5,24.99,24.99
10,Clarins,Extra-Firming Wrinkle Control Firming Day Cream Broad Spectrum SPF 15 All Skin Types,4.0,87.00,87.00
11,ULTA,Rosewater Facial Mist,4.0,10.00,10.00
12,Neutrogena,Rapid Tone Repair Moisturizer Night,4.0,23.99,23.99
13,Shiseido,BioPerformance LiftDynamic Cream,4.5,120.00,120.00
14,Milani,Green Goddess Glow Oil,4.5,19.99,19.99
15,Dermalogica,Travel Size Dynamic Skin Recovery Broad Spectrum SPF 50,4.5,22.00,22.00
16,Clinique,Travel Size Moisture Surge Hydrating Supercharged Concentrate,4.5,12.00,12.00
17,Philosophy,Travel Size Renewed Hope In A Jar,4.5,14.00,14.00
18,Mario Badescu,The Moisture Magnet SPF 15,4.5,24.00,24.00
19,Garnier,SkinActive Miracle Skin Perfector BB Cream Anti-Aging,4.0,14.99,14.99
20,boscia,Tsubaki Swirl,4.5,38.00,38.00
21,bareMinerals,SKINLONGEVITY Vital Power Moisturizer SPF 30,3.0, 			27.00, 			27.00
22,Clarins,Hydra-Essentiel Silky Cream,4.5,48.00,48.00
23,Juice Beauty,Hydrating Mist,4.0,25.00,25.00
24,Clinique,CliniqueFIT Workout Face + Body Hydrating Spray,4.0, 			10.87, 			10.87
25,Ahava,Extreme Day Cream,4.0,75.00,75.00
26,Kate Somerville,Dilo Oil Restorative Treatment,5.0,65.00,65.00
27,Clinique,Repair Sculpting Night Cream,4.0,68.00,68.00
28,Kiehl's Since 1851,Ultra Facial Cream SPF 30,4.0,32.00,32.00
29,Clarins,Rose Radiance Cream,4.5,129.00,129.00
30,Mario Badescu,Ginseng Moist Cream,4.0,18.00,18.00
31,Derma E,Firming DMAE Moisturizer,4.0,21.99,21.99
32,Neutrogena,Facial Moisturizer,4.0,12.49,12.49
33,boscia,Tsubaki Beauty Oil,5.0,46.00,46.00
34,Origins,Online Only Dr. Andrew Weil for Origins Mega-Mushroom Relief & Resilience Face Cream,4.5,69.00,69.00
35,Curél,Moisture Facial Milk,4.5,30.00,30.00
36,Neutrogena,Rapid Tone Repair Moisturizer SPF 30,4.0,23.99,23.99
37,Urban Decay Cosmetics,Online Only Drop Shot Mix-In Facial Oil,5.0,34.00,34.00
38,Clarins,Blue Orchid Face Treatment Oil,4.5,60.00,60.00
39,Murad,Prebiotic 3-In-1 MultiMist,4.5,32.00,32.00
40,Garnier,SkinActive Moisture Bomb The Antioxidant Super Moisturizer,4.5,16.99,16.99
41,Burt's Bees,100% Natural Lip Butter,5.0,4.39 , 4.99
42,Lancôme,Bienfait Multi-Vital Hydrating & Protecting Duo,3.0,71.00,71.00
43,Mamonde,Floral Hydro Cream,4.5, 			22.40, 			22.40
44,Origins,Online Only A Perfect World Antioxidant Moisturizer with White Tea,3.5,47.00,47.00
45,Philosophy,Travel Size Ultimate Miracle Worker SPF 30,4.5,28.00,28.00
