It Cosmetics,CC+ Cream with SPF 50+,4.5,39.50,39.50
bareMinerals,Complexion Rescue Tinted Hydrating Gel Cream Broad Spectrum SPF 30,4.5,32.00,32.00
Murad,Hydro-Dynamic Ultimate Moisture,4.5,75.00,75.00
It Cosmetics,Confidence In A Gel Lotion Weightless Moisturizer,4.5,36.00,36.00
Mario Badescu,Facial Spray With Aloe| Herbs and Rosewater,4.5,7.00 , 12.00
It Cosmetics,Bye Bye Foundation Full Coverage Moisturizer with SPF 50+,4.0,39.50,39.50
It Cosmetics,Confidence In A Cream Hydrating Moisturizer,4.5,49.00,49.00
Clinique,Moisture Surge 72 Hour Auto-Replenishing Hydrator,4.5,21.00 , 78.00
Mario Badescu,Spritz. Mist. Glow. Set,4.5,21.00,21.00
Juice Beauty,STEM CELLULAR Anti-Wrinkle Overnight Cream,4.0,75.00,75.00
It Cosmetics,CC+ Cream Illumination SPF 50+,4.5,39.50,39.50
PEACH & LILY,Matcha Pudding Antioxidant Cream,4.5,40.00,40.00
Neutrogena,Hydro Boost Water Gel,4.5,23.99,23.99
bareMinerals,Butter Drench Restorative Rich Cream,4.5, 			28.50, 			28.50
Tula,24-7 Moisture Hydrating Day & Night Cream,4.5,52.00,52.00
Dermadoctor,Kakadu C High Potency Evening Oil,4.0,74.00,74.00
Kiehl's Since 1851,Ultra Facial Cream,4.5,18.00 , 53.00
Perricone MD,High Potency Classics: Face Finishing & Firming Moisturizer,4.5,69.00,69.00
Philosophy,Renewed Hope In A Jar,4.5,39.00 , 65.00
Peter Thomas Roth,Hungarian Thermal Water Mineral-Rich Moisturizer,4.0,58.00,58.00
Perricone MD,High Potency Classics Face Finishing & Firming Tinted Moisturizer SPF 30,4.0,69.00,69.00
Dermalogica,Dynamic Skin Recovery Broad Spectrum SPF 50,4.5,75.00,75.00
Peter Thomas Roth,Water Drench Hyaluronic Cloud Cream,4.5, 			52.00 , 99.00
Juice Beauty,STEM CELLULAR Anti-Wrinkle Moisturizer,4.5,70.00,70.00
Origins,GinZing Oil-Free Energy-Boosting Gel Moisturizer,0.0,18.00 , 30.00
NARS,Pure Radiant Tinted Moisturizer,4.5,45.00,45.00
boscia,Cactus Water Moisturizer,4.5,38.00,38.00
Dermalogica,Skin Smoothing Cream,4.5,43.00 , 69.00
Erborian,Online Only BB Crème,4.5,39.00,39.00
Tarte,Amazonian Clay BB Tinted Moisturizer Broad Spectrum SPF 20,4.5,36.00,36.00
First Aid Beauty,Ultra Repair Cream,4.5,34.00,34.00
Dermalogica,Intensive Moisture Balance,4.5,44.00 , 72.00
It Cosmetics,Confidence in a Cream Rosy Tone Moisturizer,4.5,49.00,49.00
It Cosmetics,Confidence in Your Beauty Sleep Night Cream,4.5,54.00,54.00
PEACH & LILY,Lazy Day's All-In-One Moisture Pad,4.5, 			27.30, 			27.30
Philosophy,Ultimate Miracle Worker SPF 30,4.5,75.00,75.00
The Better Skin Co.,Better Skin Mirakle Cream,4.0, 			8.50, 			8.50
Olay,Regenerist Fragrance-Free Micro-Sculpting Cream,4.5,28.99,28.99
Tarte,BB Tinted Treatment 12 Hour Primer Broad Spectrum SPF 30,4.5,37.00,37.00
CeraVe,PM Facial Moisturizing Lotion,4.5,15.99,15.99
Lancôme,Rénergie Lift Multi-Action Lifting And Firming Cream - All Skin Types,4.5,99.00 , 119.00
StriVectin,SD Advanced Plus Intensive Moisturizing Concentrate For Wrinkles & Stretch Marks,4.5,79.00 , 139.00
Jack Black,Double Duty Face Moisturizer SPF 20,5.0,28.00 , 48.00
Mario Badescu,Facial Spray with Aloe| Chamomile and Lavender,4.0,7.00 , 12.00
Mario Badescu,Seaweed Night Cream,4.5,22.00,22.00
Olay,Regenerist Night Recovery Cream,4.5,29.99,29.99
Clinique,Moisture Surge CC Cream Hydrating Colour Corrector Broad Spectrum SPF 30,4.0,39.50,39.50
Philosophy,Anti-Wrinkle Miracle Worker+ Line Correcting Moisturizer,4.5,64.00,64.00
Olay,Regenerist Micro Sculpting Cream,4.5,28.99,28.99
Clinique,Clinique iD Dramatically Different Base,4.0,25.00,25.00
Juice Beauty,STEM CELLULAR CC Cream,4.0,39.00,39.00
Dermalogica,Sound Sleep Cocoon,4.5,82.00,82.00
It Cosmetics,Confidence In A Neck Cream Moisturizer,4.5,52.00,52.00
Juice Beauty,GREEN APPLE Age Defy Moisturizer,4.5,50.00,50.00
Origins,Clear Improvement Pore Clearing Moisturizer with Salicylic Acid,4.0,34.00,34.00
bareMinerals,Bare Haven Essential Moisturizing Soft Cream,4.5, 			26.25 , 41.25
It Cosmetics,Travel Size CC+ Cream with SPF 50+,4.0,15.50,15.50
Estée Lauder,Revitalizing Supreme+ Global Anti-Aging Cell Power Creme,4.0, 			55.00 , 65.00
Dermalogica,Antioxidant HydraMist,4.5,45.00,45.00
Mario Badescu,Hydro Moisturizer With Vitamin C,4.5,18.00,18.00
Erborian,Online Only CC Crème,4.5,44.00,44.00
Mad Hippie,Antioxidant Facial Oil,4.5,24.99,24.99
bareMinerals,Prime Time BB Primer-Cream Daily Defense Broad Spectrum SPF 30,4.5,27.00,27.00
Philosophy,Renewed Hope In A Jar Overnight,4.5,49.00,49.00
SUNDAY RILEY,Luna Sleeping Night Oil,4.5,55.00 , 105.00
Estée Lauder,DayWear Multi-Protection Anti-Oxidant 24H-Moisture Crème Broad Spectrum SPF 15,4.0, 			34.00, 			34.00
Benefit Cosmetics,Total Moisture Facial Cream,4.5,42.00,42.00
Philosophy,Purity Made Simple Moisturizer,4.0,25.00,25.00
Philosophy,Renewed Hope In A Jar SPF 30,4.5,39.00,39.00
First Aid Beauty,Ultra Repair Face Moisturizer,4.5,24.00,24.00
Perricone MD,Cold Plasma Sub-D,4.0,135.00,135.00
Skyn Iceland,Pure Cloud Cream,4.5,55.00,55.00
Dermalogica,Calm Water Gel,4.5,50.00,50.00
Clinique,Smart Night Custom-Repair Moisturizer For Dry Combination,4.5,58.00,58.00
boscia,Rosehip Omega Face Oil,4.5,42.00,42.00
Lancôme,Bienfait Multi-Vital SPF 30 Day Cream Moisturizer,4.5,50.00,50.00
StriVectin,Advanced Retinol Intensive Night Moisturizer,4.5,79.00 , 112.00
Philosophy,Renewed Hope in a Jar Water Cream Hyaluronic Glow Moisturizer,4.5,39.00,39.00
Smashbox,Photo Finish Primerizer,4.5,42.00,42.00
bareMinerals,Skinlongevity Vital Power Sleeping Gel Cream,4.5, 			28.50, 			28.50
CeraVe,AM Facial Moisturizing Lotion SPF 30,3.5,18.99,18.99
Clinique,Clinique iD Active Cartridge Concentrate,4.0,14.00,14.00
Murad,Essential-C Day Moisture Broad Spectrum SPF 30 / PA+++,4.5,65.00,65.00
Tarte,Maracuja Oil,4.5,48.00,48.00
Jack Black,Intense Therapy Lip Balm SPF 25,4.5,8.00,8.00
CeraVe,Skin Renewing Night Cream,4.5,18.49,18.49
Mad Hippie,Face Cream,4.5,25.99,25.99
PEACH & LILY,Pure Beam Luxe Oil,4.5, 			27.30, 			27.30
Lancôme,Bienfait Multi-Vital Night Cream Moisturizer,5.0,54.00,54.00
Mamonde,Rose Trial Kit,4.5, 			15.40, 			15.40
e.l.f. Cosmetics,Holy Hydration! Face Cream,4.5,12.00,12.00
MAC,Strobe Cream,4.5, 			21.00 , 35.00
Hey Honey,Online Only Trick and Treat CC² Active Propolis Color Correcting Cream,5.0,38.00,38.00
Clinique,Smart Broad Spectrum SPF 15 Custom-Repair Moisturizer For Dry Combination Skin,4.5,55.00,55.00
Philosophy,Ultimate Miracle Worker Night,4.0,80.00,80.00
Aquaphor,Lip Repair,4.5, 			2.99, 			2.99
ICONIC LONDON,Online Only Prep Set Glow,4.0,25.00,25.00
Clinique,Moisture Surge Hydrating Supercharged Concentrate,4.5,39.50,39.50
Clinique,Clinique Smart Clinical MD Multi-Dimensional Age Transformer Duo Resculpt + Revolumize,4.0,69.00,69.00
Neutrogena,Bright Boost Gel Cream,3.0,23.99,23.99
Origins,High-Potency Night-A-Mins Oil-Free Resurfacing Cream with Fruit-Derived AHAs,3.5,46.00,46.00
Kate Somerville,Wrinkle Warrior 2-in-1 Plumping Moisturizer + Serum,4.5,95.00,95.00
Exuviance,Age Reverse Day Repair SPF 30,4.5,75.00,75.00
Smashbox,Photo Finish Primer Oil,4.5,42.00,42.00
Dermalogica,Sheer Tint SPF 20,4.5,45.00,45.00
Mario Badescu,Oil Free Moisturizer SPF 30,4.0,28.00,28.00
SUNDAY RILEY,Online Only Tidal Brightening Enzyme Water Cream,4.0,22.00 , 65.00
Tula,Dew Your Thing Oil Free Gel Cream,4.5,48.00,48.00
Mario Badescu,Vitamin A-D-E Neck Cream,4.5,20.00,20.00
Juice Beauty,STEM CELLULAR Lifting Neck Cream,4.5,60.00,60.00
It Cosmetics,Travel Size Confidence In A Cream Hydrating Moisturizer,4.5,17.00,17.00
Derma E,Vitamin C Intense Night Cream,4.5,19.99,19.99
Origins,GinZing Ultra-Hydrating Energy-Boosting Cream,4.0,30.00,30.00
Neutrogena,Rapid Wrinkle Repair Night Moisturizer,4.0,23.99,23.99
Olay,Total Effects Night Firming Cream,4.5,24.99,24.99
Estée Lauder,Revitalizing Supreme+ Global Anti-Aging Cell Power Creme SPF 15,4.0, 			55.00 , 80.00
Clinique,Dramatically Different Hydrating Jelly,4.0,15.00 , 28.00
Derma E,Online Only Advanced Peptide & Collagen Serum,5.0,36.50,36.50
Philosophy,Anti-Wrinkle Miracle Worker+ Line Correcting Moisturizer Overnight Cream,3.5,68.00,68.00
First Aid Beauty,Ultra Repair Oat & Cannabis Sativa Seed Oil,4.0,30.00,30.00
Erborian,Online Only CC Red Correct,4.5,44.00,44.00
Peter Thomas Roth,Water Drench Hyaluronic Cloud Serum,4.5,65.00,65.00
La Roche-Posay,Toleriane Double Repair Face Moisturizer UV SPF 30,4.0,19.99,19.99
Mario Badescu,Collagen Moisturizer SPF 15,4.0,24.00,24.00
SUNDAY RILEY,C.E.O. Vitamin C Rich Hydration Cream,4.0,22.00 , 65.00
ULTA,Waterfull Gel - Cream Moisturizer,4.5,19.50,19.50
Origins,A Perfect World SPF 40 Age-Defense Moisturizer with White Tea,4.0,46.00,46.00
It Cosmetics,Anti-Aging Armour Tinted Sunscreen SPF 50+,4.5,38.00,38.00
Murad,Oil and Pore Control Mattifier Broad Spectrum SPF 45 PA++++,4.0,42.00,42.00
SUNDAY RILEY,C.E.O. Glow Vitamin C and Turmeric Face Oil,3.5,40.00 , 80.00
Murad,Nutrient-Charged Water Gel,4.5,60.00,60.00
IPKN,Online Only Moist & Firm BB Cream,4.5,29.00,29.00
Teami Blends,Repair Tea Infused Facial Oil,4.5, 			24.00, 			24.00
Mamonde,Rose Water Gel Cream,4.5, 			18.20, 			18.20
Neutrogena,Rapid Wrinkle Repair Moisturizer SPF 30,4.5,23.99,23.99
Trilogy,Certified Organic Rosehip Oil,4.5, 			20.30 , 37.80
Estée Lauder,Online Only Resilience Multi-Effect Tri-Peptide Face and Neck Creme SPF 15,4.0, 			58.00 , 90.00
Kiehl's Since 1851,Super Multi Corrective Cream,5.0,65.00,65.00
Ahava,Essential Day Moisturizer Normal to Dry,4.5,45.00,45.00
Neutrogena,Rapid Wrinkle Repair Retinol Oil,4.0,27.99,27.99
Lancôme,UV Expert Mineral CC Cream SPF 50,3.0,39.00,39.00
Mario Badescu,Travel Size Facial Spray with Aloe| Chamomile and Lavender,4.5,5.00,5.00
First Aid Beauty,Ultra Repair Tinted Moisturizer SPF 30,3.5,28.00,28.00
StriVectin,Tightening & Sculpting Face Cream,4.5,95.00,95.00
Perricone MD,High Potency Classics Hyaluronic Intensive Moisturizer,4.5,69.00,69.00
Kate Somerville,Age Arrest Anti-Wrinkle Cream,5.0,90.00,90.00
Kate Somerville,ExfoliKate Glow Moisturizer,4.5,65.00,65.00
Perricone MD,Cold Plasma+ Neck & Chest Broad Spectrum SPF 25,4.5,89.00,89.00
Murad,Retinol Youth Renewal Night Cream,5.0,82.00,82.00
Mad Hippie,Hydrating Nutrient Mist,4.0,19.99,19.99
Skyn Iceland,Oxygen Infusion Night Cream,4.0,68.00,68.00
Skyn Iceland,Hydro Cool Firming Neck Gels,5.0,35.00,35.00
NYX Professional Makeup,BB Cream,4.5,13.00,13.00
Proactiv,Green Tea Moisturizer,4.5,40.00,40.00
Lancôme,Visionnaire Advanced Multi-Correcting Cream,4.5,90.00,90.00
Murad,Anti-Aging Moisturizer Broad Spectrum SPF 30 / PA+++,4.5,50.00,50.00
Tarte,Travel Size Maracuja Oil,4.5,16.00,16.00
Vichy,LiftActiv Peptide-C Anti-Aging Face Moisturizer,4.5,39.00,39.00
Kate Somerville,Goat Milk Moisturizing Cream,4.5,65.00,65.00
Tarte,Sugar Rush - Don't Hate| Hydrate Oil Free Moisturizer Mini,4.0,10.00,10.00
Tarte,Double Duty Beauty First Step Prep Moisture Reset Cream,4.5, 			26.25, 			26.25
Estée Lauder,Online Only NightWear Plus Anti-Oxidant Night Detox Crème,4.5, 			36.00, 			36.00
Origins,Plantscription Youth-Renewing Power Night Cream,4.5,62.00,62.00
Cetaphil,Moisturizing Cream,4.5,10.99 , 17.99
Perricone MD,Essential Fx Acyl-Glutathione Rejuvenating Moisturizer,4.5, 			68.60, 			68.60
Bliss,Drench & Quench Moisturizer,4.5,20.00,20.00
e.l.f. Cosmetics,SuperHydrate Moisturizer,3.5,12.00,12.00
L'Oréal,Studio Secrets Magic Skin Beautifier B.B. Cream,4.0,11.99,11.99
Kiehl's Since 1851,Cannabis Sativa Seed Oil Herbal Concentrate,4.5,50.00,50.00
Exuviance,Lift Volumizing Concentrate,4.5,87.00,87.00
Botanics,Botanics Organic Restoring Night Oil,5.0,17.99,17.99
Cetaphil,Daily Facial Moisturizer,4.0,16.99,16.99
MAC,Strobe Cream Mini MAC,4.5,16.00,16.00
Juice Beauty,STEM CELLULAR Vinifera Replenishing Oil,5.0,72.00,72.00
Thayers,Alcohol-Free Witch Hazel Facial Mist,5.0,10.95,10.95
Eos,FlavorLab Super Soft Shea Lip Balm Duo,4.0, 			4.39, 			4.39
ULTA,Watermelon Facial Mist,4.0,10.00,10.00
Shiseido,Bio-Performance Advanced Super Revitalizing Cream,4.5,82.00 , 104.00
belif,The True Cream-Aqua Bomb,5.0,38.00,38.00
StriVectin,Travel Size TL Tightening Neck Cream,4.0,15.00,15.00
Pacifica,Coconut Probiotic Water Rehab Cream,4.5,16.00,16.00
StriVectin,Online Only The Little Lifters Limited Edition Kit,5.0,59.00,59.00
StriVectin,S.T.A.R. Light Retinol Night Oil,4.5,99.00,99.00
Exuviance,CitraFirm Face Oil,5.0, 			50.40, 			50.40
ULTA,Velvetskin Melting Moisturizer,4.0,19.50,19.50
Clinique,Dramatically Different Moisturizing BB-Gel,4.0,15.00,15.00
Mamonde,Calming Hydro Sleeping Mask,4.5, 			17.50, 			17.50
Cetaphil,Moisturizing Lotion,4.5,13.99,13.99
Kiehl's Since 1851,Ultra Facial Oil-Free Gel-Cream,5.0,32.00,32.00
Clinique,Clinique Smart Clinical MD Multi-Dimensional Age Transformer Resculpt,4.5,69.00,69.00
La Roche-Posay,Online Only Toleriane Double Repair Moisturizer,4.0,19.99,19.99
Peter Thomas Roth,Potent-C Bright & Plump Moisturizer,3.5,26.00 , 68.00
Dermalogica,Clear Start Clearing Defense Moisturizer SPF 30,4.5,28.00,28.00
StriVectin,Tightening Neck Serum Roller,4.5,89.00,89.00
The Body Shop,Vitamin C Daily Moisturizer SPF 30,4.0,23.00,23.00
Neutrogena,Oil-Free Moisture Sensitive Skin Ultra-Gentle Facial Moisturizer,4.5,12.49,12.49
I Dew Care,Plush Party Buttery Vitamin C Lip Mask,4.5,16.00,16.00
Origins,Travel Size Original Skin Matte Moisturizer with Willowherb,5.0,20.50,20.50
Dermalogica,Phyto Replenish Oil,4.5,76.00,76.00
Juice Beauty,Nutrient Moisturizer,4.0,42.00,42.00
ELEMIS,Pro-Collagen Marine Cream SPF 30,4.5,128.00,128.00
Lancôme,Bienfait Multi-Vital Sunscreen Lotion Broad Spectrum SPF 30,5.0,50.00,50.00
Clinique,Clinique Smart Clinical MD Multi-Dimensional Age Transformer Revolumize,4.5,69.00,69.00
Clinique,Age Defense BB Cream Broad Spectrum SPF 30,4.0,39.50,39.50
bareMinerals,Smart Combination Smoothing Lightweight Emulsion,4.5, 			26.25, 			26.25
belif,The True Cream-Moisturizing Bomb,5.0,38.00,38.00
Neutrogena,Rapid Wrinkle Repair Serum,4.0,23.99,23.99
Eos,100% Natural Shea Lip Balm 2 Pack,4.0, 			4.39, 			4.39
Lancôme,Rénergie Multi-Glow Rosy Tone Moisturizer Cream,4.5,99.00,99.00
Perricone MD,Online Only Vitamin C Ester Brightening Overnight Treatment,4.5,99.00,99.00
MAC,Mineralize Timecheck Lotion,4.0,45.00,45.00
Murad,City Skin Overnight Detox Moisturizer,4.5,72.00,72.00
bareMinerals,Complexion Rescue Defense Radiant Protective Veil Broad Spectrum SPF 30,4.0,39.00,39.00
Proactiv,Complexion Perfecting Hydrator,4.5,50.00,50.00
Murad,Resurgence Age-Balancing Moisture Broad Spectrum SPF 30 / PA+++,4.5,74.00,74.00
Origins,High-Potency Night-A-Mins Resurfacing Cream with Fruit-Derived AHAs,3.5,46.00,46.00
bareMinerals,Ageless Genius Firming & Wrinkle Smoothing Neck Cream,3.5, 			33.75, 			33.75
bareMinerals,Poreless Oil-Free Moisturizer,5.0,35.00,35.00
L'Oréal,Online Only Collagen Moisture Filler Facial Day Night Cream,4.5,11.49,11.49
boscia,Green Tea Oil-free Moisturizer,4.0,38.00,38.00
COSRX,Advanced Snail 92 All In One Cream,4.0,22.00,22.00
Clinique,Repairwear Laser Focus Night Line Smoothing Cream Very Dry to Dry Combination,4.5,53.00,53.00
Kiehl's Since 1851,Daily Reviving Concentrate,5.0,50.00 , 75.00
Formula 10.0.6,Seriously Shine Free Mattifying Oil Free Moisturizer,3.5,6.99,6.99
Oh K!,Chok Chok Glowing Moisturiser,4.5,14.99,14.99
Murad,Multi-Vitamin Infusion Oil,4.5,73.00,73.00
Juice Beauty,Prebiotix Hydrating Gel Moisturizer,4.0,52.00,52.00
boscia,Revitalizing Black Charcoal Hydration Gel,5.0,40.00,40.00
Murad,Perfecting Day Cream Broad Spectrum SPF 30 / PA +++,4.5,58.00,58.00
The Body Shop,Vitamin E Moisture Cream,4.0,20.00,20.00
Trilogy,Rosehip Oil Antioxidant+,4.5, 			30.80, 			30.80
Peter Thomas Roth,Peptide 21 Lift & Firm Moisturizer,4.5,78.00,78.00
Mamonde,Floral Moisture Cream,4.5, 			24.50, 			24.50
Skinfood,Peach Jelly Soothing Gel 90,4.5,3.99,3.99
TONYMOLY,Cat's Purrfect Day Cream,5.0,20.00,20.00
DHC,Online Only Extra Nighttime Moisture,5.0,36.00,36.00
Lancôme,UV Expert Aquagel Defense Primer & Moisturizer SPF 50,4.5,39.00,39.00
Meaningful Beauty,Age Recovery Night Crème with Melon Extract & Retinol,4.5,68.00,68.00
The Body Shop,Vitamin E Nourishing Night Cream,4.5,22.00,22.00
Clarins,Super Restorative Night,4.5,137.00,137.00
Shiseido,Essential Energy Moisturizing Cream,4.5,48.00,48.00
Clarins,Multi-Active Day Cream SPF 20,4.5,55.00,55.00
Estée Lauder,Online Only DayWear Multi-Protection Anti-Oxidant Sheer Tint Release Moisturizer SPF 15,4.0, 			34.00, 			34.00
First Aid Beauty,5 in 1 Face Cream SPF 30,4.0,40.00,40.00
First Aid Beauty,Ultra Repair Cream Mango,5.0,34.00,34.00
Grown Alchemist,Hydra-Repair Day Cream,5.0,49.00,49.00
Derma E,Vitamin C Renewing Moisturizer,4.5,19.99,19.99
TONYMOLY,Panda's Dream Rose Hyaluronic Face Cream,4.5,18.50,18.50
Estée Lauder,Online Only Resilience Multi-Effect Night Tri-Peptide Face and Neck Crème,3.5, 			75.00, 			75.00
ACURE,Brightening Day Cream,4.5,16.99,16.99
Ahava,Night Replenisher Normal to Dry,4.5,51.00,51.00
Peter Thomas Roth,Travel Size Water Drench Hyaluronic Cloud Cream,4.5,22.00,22.00
Vichy,Aqualia Thermal Hydrating Night Cream with Hyaluronic Acid,4.5,28.00,28.00
Derma E,Hydrating Day Cream,4.0,24.99,24.99
TONYMOLY,The Chok Chok Green Tea Watery Cream,4.5,25.00,25.00
Kiehl's Since 1851,Ultra Facial Moisturizer,4.5,32.00,32.00
Skyn Iceland,Arctic Face Oil,4.5,42.00,42.00
Clarins,Extra-Firming Wrinkle Control Regenerating Night Cream All Skin Types,4.5,93.00,93.00
Juice Beauty,Travel Size STEM CELLULAR Anti-Wrinkle Moisturizer,5.0,25.00,25.00
Clarins,Super Restorative Day,4.5,129.00,129.00
Lancôme,Bienfait Aqua Vital Lotion Continuous Infusing Moisturizer,4.5,50.00,50.00
StriVectin,TL Advanced Light Tightening Neck Cream,4.5,95.00,95.00
COSRX,Oil Free Moisturizing Lotion,4.0,22.00,22.00
e.l.f. Cosmetics,Daily Hydration Moisturizer,4.0,8.00,8.00
House 99 by David Beckham,Greater Look Face Moisturiser,4.0,25.00,25.00
Jack Black,Clean Break Oil-Free Moisturizer,5.0,30.00,30.00
Clinique,Smart Broad Spectrum SPF 15 Custom-Repair Moisturizer For Combination Oily Skin,4.5,55.00,55.00
Clinique,Clinique For Men Maximum Hydrator Activated Water-Gel Concentrate,4.5,39.50,39.50
Peter Thomas Roth,Water Drench Hyaluronic Cloud Hydrating Toner Mist,4.0,28.00,28.00
Kopari Beauty,Coconut Face Cream,5.0,38.00,38.00
ACURE,The Essentials Rosehip Oil,4.5,12.99,12.99
StriVectin,Multi-Action Restorative Cream,4.5,95.00,95.00
Clarins,Super Restorative Day SPF 20,4.5,129.00,129.00
e.l.f. Cosmetics,Hydrating Coconut Mist,4.5,8.00,8.00
Kiehl's Since 1851,Super Multi Corrective Cream SPF 30,5.0,68.00,68.00
Fountain of Truth,Good Day Soufflé Hydrating Moisturizer with SPF 15,4.5,60.00,60.00
ELEMIS,Superfood Day Cream,4.5,45.00,45.00
COSRX,Hyaluronic Acid Intensive Cream,4.5,22.00,22.00
The Body Shop,Online Only Oils Of Life Intensely Revitalising Cream,5.0,34.00,34.00
Peter Thomas Roth,10% Glycolic Solutions Moisturizer,4.0,45.00,45.00
Exuviance,Glycolic Expert Moisturizer,4.0, 			32.20, 			32.20
PEACH & LILY,KBeauty Rescue Balm,4.0,28.00,28.00
Derma E,Derma E x SunKissAlba Radiant Glow Oil,4.5,19.99,19.99
Clarins,Multi-Active Night Cream| Normal to Combination Skin,4.5,58.00,58.00
Philosophy,Nature In A Jar Cica Complex Recovery Moisturizer,4.5,49.00,49.00
Kiehl's Since 1851,Ultra Facial Moisturizer SPF 30,4.5,32.00,32.00
Origins,Plantscription Powerful Lifting Cream,4.0,65.00,65.00
Origins,Blooming Sheer Lip Balm,4.5,20.00,20.00
DHC,Online Only Astaxanthin All-In-One Collagen Gel,4.5,49.00,49.00
